{
    "$schema": "../../set.schema.json",
    "species": "SPECIES_FLOATZEL",
    "moves": [ "MOVE_WATERFALL", "MOVE_AQUA_JET", "MOVE_LOW_KICK", "MOVE_PROTECT" ],
    "ev_flags": {
        "hp": false,
        "attack": false,
        "defense": false,
        "speed": false,
        "special_attack": false,
        "special_defense": false
    },
    "nature": "NATURE_HASTY",
    "item": "ITEM_WACAN_BERRY",
    "form": 0
}
