{
    "$schema": "../../set.schema.json",
    "species": "SPECIES_DUSKULL",
    "moves": [ "MOVE_PAYBACK", "MOVE_WILL_O_WISP", "MOVE_CONFUSE_RAY", "MOVE_PURSUIT" ],
    "ev_flags": {
        "hp": false,
        "attack": false,
        "defense": false,
        "speed": false,
        "special_attack": false,
        "special_defense": false
    },
    "nature": "NATURE_JOLLY",
    "item": "ITEM_NONE",
    "form": 0
}
