{
    "$schema": "../../set.schema.json",
    "species": "SPECIES_THROH",
    "moves": [ "MOVE_REVENGE", "MOVE_STORM_THROW", "MOVE_CIRCLE_THROW", "MOVE_BULK_UP" ],
    "ev_flags": {
        "hp": false,
        "attack": false,
        "defense": false,
        "speed": false,
        "special_attack": false,
        "special_defense": false
    },
    "nature": "NATURE_CAREFUL",
    "item": "ITEM_NONE",
    "form": 0
}
