{
    "$schema": "../../set.schema.json",
    "species": "SPECIES_PANPOUR",
    "moves": [ "MOVE_SCALD", "MOVE_TAUNT", "MOVE_WATER_SPORT", "MOVE_LEER" ],
    "ev_flags": {
        "hp": false,
        "attack": false,
        "defense": false,
        "speed": true,
        "special_attack": true,
        "special_defense": false
    },
    "nature": "NATURE_MODEST",
    "item": "ITEM_CHERI_BERRY",
    "form": 0
}
