{
    "$schema": "../../set.schema.json",
    "species": "SPECIES_CRUSTLE",
    "moves": [ "MOVE_ROCK_SLIDE", "MOVE_X_SCISSOR", "MOVE_SOLAR_BEAM", "MOVE_SHELL_SMASH" ],
    "ev_flags": {
        "hp": false,
        "attack": true,
        "defense": false,
        "speed": true,
        "special_attack": false,
        "special_defense": false
    },
    "nature": "NATURE_NAIVE",
    "item": "ITEM_POWER_HERB",
    "form": 0
}
