{
    "$schema": "../../set.schema.json",
    "species": "SPECIES_PORYGON2",
    "moves": [ "MOVE_TRI_ATTACK", "MOVE_THUNDERBOLT", "MOVE_PSYCHIC", "MOVE_ICE_BEAM" ],
    "ev_flags": {
        "hp": true,
        "attack": false,
        "defense": false,
        "speed": false,
        "special_attack": true,
        "special_defense": false
    },
    "nature": "NATURE_MODEST",
    "item": "ITEM_CHOICE_SPECS",
    "form": 0
}
