{
    "$schema": "../../set.schema.json",
    "species": "SPECIES_SWOOBAT",
    "moves": [ "MOVE_AIR_SLASH", "MOVE_PSYCHIC", "MOVE_ATTRACT", "MOVE_CALM_MIND" ],
    "ev_flags": {
        "hp": false,
        "attack": false,
        "defense": false,
        "speed": false,
        "special_attack": false,
        "special_defense": false
    },
    "nature": "NATURE_TIMID",
    "item": "ITEM_PETAYA_BERRY",
    "form": 0
}
