{
    "$schema": "../../set.schema.json",
    "species": "SPECIES_HAXORUS",
    "moves": [ "MOVE_OUTRAGE", "MOVE_EARTHQUAKE", "MOVE_BRICK_BREAK", "MOVE_DRAGON_DANCE" ],
    "ev_flags": {
        "hp": false,
        "attack": true,
        "defense": false,
        "speed": true,
        "special_attack": false,
        "special_defense": false
    },
    "nature": "NATURE_JOLLY",
    "item": "ITEM_FOCUS_SASH",
    "form": 0
}
