{
    "$schema": "../../set.schema.json",
    "species": "SPECIES_GOLBAT",
    "moves": [ "MOVE_VENOSHOCK", "MOVE_TOXIC", "MOVE_FLY", "MOVE_MEAN_LOOK" ],
    "ev_flags": {
        "hp": false,
        "attack": false,
        "defense": false,
        "speed": false,
        "special_attack": false,
        "special_defense": false
    },
    "nature": "NATURE_CALM",
    "item": "ITEM_NONE",
    "form": 0
}
