{
    "$schema": "../../set.schema.json",
    "species": "SPECIES_VICTREEBEL",
    "moves": [ "MOVE_WEATHER_BALL", "MOVE_SOLAR_BEAM", "MOVE_SLUDGE_BOMB", "MOVE_GASTRO_ACID" ],
    "ev_flags": {
        "hp": false,
        "attack": false,
        "defense": false,
        "speed": true,
        "special_attack": true,
        "special_defense": false
    },
    "nature": "NATURE_MODEST",
    "item": "ITEM_LIFE_ORB",
    "form": 0
}
