{
    "$schema": "../../set.schema.json",
    "species": "SPECIES_MAMOSWINE",
    "moves": [ "MOVE_HAIL", "MOVE_EARTHQUAKE", "MOVE_SUPERPOWER", "MOVE_FISSURE" ],
    "ev_flags": {
        "hp": true,
        "attack": true,
        "defense": false,
        "speed": false,
        "special_attack": false,
        "special_defense": false
    },
    "nature": "NATURE_ADAMANT",
    "item": "ITEM_LAX_INCENSE",
    "form": 0
}
