{
    "$schema": "../../set.schema.json",
    "species": "SPECIES_HERACROSS",
    "moves": [ "MOVE_AERIAL_ACE", "MOVE_STONE_EDGE", "MOVE_FACADE", "MOVE_SHADOW_CLAW" ],
    "ev_flags": {
        "hp": false,
        "attack": false,
        "defense": false,
        "speed": false,
        "special_attack": false,
        "special_defense": false
    },
    "nature": "NATURE_JOLLY",
    "item": "ITEM_COBA_BERRY",
    "form": 0
}
