{
    "$schema": "../../set.schema.json",
    "species": "SPECIES_SCIZOR",
    "moves": [ "MOVE_BUG_BITE", "MOVE_AERIAL_ACE", "MOVE_ROOST", "MOVE_BULLET_PUNCH" ],
    "ev_flags": {
        "hp": true,
        "attack": true,
        "defense": false,
        "speed": false,
        "special_attack": false,
        "special_defense": false
    },
    "nature": "NATURE_ADAMANT",
    "item": "ITEM_OCCA_BERRY",
    "form": 0
}
