{
    "$schema": "../../set.schema.json",
    "species": "SPECIES_ESPEON",
    "moves": [ "MOVE_PSYCHIC", "MOVE_SHADOW_BALL", "MOVE_HYPER_BEAM", "MOVE_GRASS_KNOT" ],
    "ev_flags": {
        "hp": false,
        "attack": false,
        "defense": false,
        "speed": true,
        "special_attack": true,
        "special_defense": false
    },
    "nature": "NATURE_MODEST",
    "item": "ITEM_LUM_BERRY",
    "form": 0
}
