{
    "$schema": "../../set.schema.json",
    "species": "SPECIES_SPIRITOMB",
    "moves": [ "MOVE_WILL_O_WISP", "MOVE_SHADOW_SNEAK", "MOVE_SWAGGER", "MOVE_PSYCH_UP" ],
    "ev_flags": {
        "hp": true,
        "attack": false,
        "defense": false,
        "speed": false,
        "special_attack": false,
        "special_defense": true
    },
    "nature": "NATURE_CAREFUL",
    "item": "ITEM_LEFTOVERS",
    "form": 0
}
