{
    "$schema": "../../set.schema.json",
    "species": "SPECIES_ALAKAZAM",
    "moves": [ "MOVE_PSYSHOCK", "MOVE_SHADOW_BALL", "MOVE_FOCUS_BLAST", "MOVE_CHARGE_BEAM" ],
    "ev_flags": {
        "hp": false,
        "attack": false,
        "defense": false,
        "speed": true,
        "special_attack": true,
        "special_defense": false
    },
    "nature": "NATURE_TIMID",
    "item": "ITEM_COLBUR_BERRY",
    "form": 0
}
