{
    "$schema": "../../set.schema.json",
    "species": "SPECIES_MANECTRIC",
    "moves": [ "MOVE_FLAMETHROWER", "MOVE_OVERHEAT", "MOVE_DISCHARGE", "MOVE_CHARGE" ],
    "ev_flags": {
        "hp": false,
        "attack": false,
        "defense": false,
        "speed": true,
        "special_attack": true,
        "special_defense": false
    },
    "nature": "NATURE_MODEST",
    "item": "ITEM_CHARCOAL",
    "form": 0
}
