{
    "$schema": "../../set.schema.json",
    "species": "SPECIES_GALLADE",
    "moves": [ "MOVE_CLOSE_COMBAT", "MOVE_PSYCHO_CUT", "MOVE_SLASH", "MOVE_BULK_UP" ],
    "ev_flags": {
        "hp": false,
        "attack": true,
        "defense": false,
        "speed": true,
        "special_attack": false,
        "special_defense": false
    },
    "nature": "NATURE_JOLLY",
    "item": "ITEM_COBA_BERRY",
    "form": 0
}
